BusinessName,FullAddress,StreetAddress,City,State,Zip,PlusCode,Website,Phone,LatLong,Category,Hours,IsClaimed,Rating,ReviewCount,Amenities,NumberOfPhotos,ImageURL,URL
Ciputra International,"Jl. Lkr. Luar Barat No.101, Rw. Buaya, Kecamatan Cengkareng, Kota Jakarta Barat, Daerah Khusus Ibukota Jakarta 11740","Jl. Lkr. Luar Barat No.101, Rw. Buaya, Kecamatan Cengkareng",Kota Jakarta Barat,Daerah Khusus Ibukota Jakarta,11740,RPGH+6H,ciputrainternational.com,(021) 22585050,"-6.1743911, 106.7288847",Developer Rumah Hunian Khusus,"Rabu 08.30–17.30,Kamis 08.30–17.30,Jumat 08.30–17.30,Sabtu 08.30–17.30,Minggu 08.30–17.30,Senin 08.30–17.30,Selasa 08.30–17.30. Sembunyikan jam buka untuk seminggu",N,"4,4",287,,1346,https://lh5.googleusercontent.com/p/AF1QipPNb8kI6k0KReT0u4Fn1Hz4FUhrx-tM-zhWwJ58=w408-h544-k-no,"https://www.google.com/maps/place/Ciputra+International/@-6.2086897,106.5741444,10z/data=!4m8!1m2!2m1!1sperusahaan+di+dekat+Ciputra+International+Puri+jakarta+barat!3m4!1s0x2e69f783ffdf5487:0xdc808159fbb53c1a!8m2!3d-6.1743911!4d106.7288847"
PT Mayora Indah Tbk,"Jalan Daan Mogot KM.18, RT.1/RW.8, Cengkareng, Kalideres, RT.1/RW.8, Kalideres, Kec. Kalideres, Kota Jakarta Barat, Daerah Khusus Ibukota Jakarta 11840","Jalan Daan Mogot KM.18, RT.1/RW.8, Cengkareng, Kalideres, RT.1/RW.8, Kalideres, Kec. Kalideres",Kota Jakarta Barat,Daerah Khusus Ibukota Jakarta,11840,RMRW+J2,mayoraindah.co.id,(021) 80637700,"-6.1584027, 106.6950682",Kantor Perusahaan,"Rabu 08.00–17.00,Kamis 08.00–17.00,Jumat 08.00–17.00,Sabtu Tutup,Minggu Tutup,Senin 08.00–17.00,Selasa 08.00–17.00. Sembunyikan jam buka untuk seminggu",Y,"4,5",1496,,692,https://lh5.googleusercontent.com/p/AF1QipOfmD9i8fekTw-DYGdOY6sd119DRDTkfDzoA7g=w408-h306-k-no,"https://www.google.com/maps/place/PT+Mayora+Indah+Tbk/@-6.2086897,106.5741444,10z/data=!4m8!1m2!2m1!1sperusahaan+di+dekat+Ciputra+International+Puri+jakarta+barat!3m4!1s0x2e69f86a19546dc9:0x8ad2f24f53a24247!8m2!3d-6.1584027!4d106.6950682"
FIF Group,"Ruko Mutiara Taman Palem Blok A2/1, Kamal Raya Outer Ring Road, Cengkareng, RT.7/RW.14, Cengkareng Tim., Kecamatan Cengkareng, Kota Jakarta Barat, Daerah Khusus Ibukota Jakarta 11730","Ruko Mutiara Taman Palem Blok A2/1, Kamal Raya Outer Ring Road, Cengkareng, RT.7/RW.14, Cengkareng Tim., Kecamatan Cengkareng",Kota Jakarta Barat,Daerah Khusus Ibukota Jakarta,11730,VP6J+C9,fifgroup.co.id,(021) 29405816,"-6.1389904, 106.7309305",Kantor Perusahaan,"Rabu 08.00–16.00,Kamis 08.00–16.00,Jumat 08.00–16.00,Sabtu 08.00–12.00,Minggu Tutup,Senin 08.00–16.00,Selasa 08.00–16.00. Sembunyikan jam buka untuk seminggu",N,"3,6",136,,10,https://lh5.googleusercontent.com/p/AF1QipOWvxM1hlI9GjN35zp7zYhBKtgCQrV3W4QtX0YU=w408-h725-k-no,"https://www.google.com/maps/place/FIF+Group/@-6.2086897,106.5741444,10z/data=!4m8!1m2!2m1!1sperusahaan+di+dekat+Ciputra+International+Puri+jakarta+barat!3m4!1s0x2e6a1d5636ceeb5d:0xc24f87a34dea94b2!8m2!3d-6.1389904!4d106.7309305"
Tokopedia Care Tower,"TOKOPEDIA CARE TOWER - Ground Floor Ciputra International, Jl. Lkr. Luar Barat No.101, RT.13, Rw. Buaya, Kecamatan Cengkareng, Kota Jakarta Barat, Daerah Khusus Ibukota Jakarta 11740               Terletak di: Ciputra International","TOKOPEDIA CARE TOWER - Ground Floor Ciputra International, Jl. Lkr. Luar Barat No.101, RT.13, Rw. Buaya, Kecamatan Cengkareng",Kota Jakarta Barat,Daerah Khusus Ibukota Jakarta,11740               Terletak di: Ciputra International,RPGH+GF,tokopedia.com,,"-6.1736627, 106.7286946",Kantor Perusahaan,"Rabu 09.00–17.00,Kamis 09.00–17.00,Jumat 09.00–17.00,Sabtu 09.00–17.00,Minggu 09.00–17.00,Senin 09.00–17.00,Selasa 09.00–17.00. Sembunyikan jam buka untuk seminggu",N,"4,5",69,,73,https://lh5.googleusercontent.com/p/AF1QipOxePM6NuvE9Y2NPVSn4nfO76_ZVTZ1K0EsJReW=w408-h306-k-no,"https://www.google.com/maps/place/Tokopedia+Care+Tower/@-6.2086897,106.5741444,10z/data=!4m8!1m2!2m1!1sperusahaan+di+dekat+Ciputra+International+Puri+jakarta+barat!3m4!1s0x2e69f73879ba01a7:0x19ff04518acfcf15!8m2!3d-6.1736627!4d106.7286946"
Puri Indah Financial Tower,"Jl. Puri Lkr. Dalam Jl. Puri Indah Raya Blok T No.8, RT.1/RW.2, Kembangan Sel., Kec. Kembangan, Kota Jakarta Barat, Daerah Khusus Ibukota Jakarta 11610","Jl. Puri Lkr. Dalam Jl. Puri Indah Raya Blok T No.8, RT.1/RW.2, Kembangan Sel., Kec. Kembangan",Kota Jakarta Barat,Daerah Khusus Ibukota Jakarta,11610,RP6P+HJ,pift.co.id,(021) 29603999,"-6.1885582, 106.7365535",Kantor Perusahaan,"Rabu 08.30–22.00,Kamis 08.30–22.00,Jumat 08.30–22.00,Sabtu 08.30–22.00,Minggu 08.30–22.00,Senin 08.30–22.00,Selasa 08.30–22.00. Sembunyikan jam buka untuk seminggu",Y,"4,4",489,,460,https://lh5.googleusercontent.com/p/AF1QipMxOMZ1V8sanvNidGZ5ycPiUFCAyPHg8RGKwFni=w408-h612-k-no,"https://www.google.com/maps/place/Puri+Indah+Financial+Tower/@-6.2086897,106.5741444,10z/data=!4m8!1m2!2m1!1sperusahaan+di+dekat+Ciputra+International+Puri+jakarta+barat!3m4!1s0x2e69f770167bf84b:0x6b40d6f568c024fa!8m2!3d-6.1885582!4d106.7365535"
SS cengkareng barat ANTERAJA,"RT.8/RW.7, no, RT.4/RW.6, Tegal Alur, Kec. Kalideres, Kota Jakarta Barat, Daerah Khusus Ibukota Jakarta 11820","RT.8/RW.7, no, RT.4/RW.6, Tegal Alur, Kec. Kalideres",Kota Jakarta Barat,Daerah Khusus Ibukota Jakarta,11820,VPH9+XX,anteraja.id,,"-6.1200612, 106.7199331",Kantor Perusahaan,"Rabu 06.00–19.00,Kamis 06.00–19.00,Jumat 06.00–19.00,Sabtu 06.00–19.00,Minggu 06.00–19.00,Senin 06.00–19.00,Selasa 06.00–19.00. Sembunyikan jam buka untuk seminggu",N,"5,0",1,,3,https://lh5.googleusercontent.com/p/AF1QipOKzNVT2x5xgv5wSOOJepdpl321ap9Fbc2zh_es=w408-h725-k-no,"https://www.google.com/maps/place/SS+cengkareng+barat+ANTERAJA/@-6.2086897,106.5741444,10z/data=!4m8!1m2!2m1!1sperusahaan+di+dekat+Ciputra+International+Puri+jakarta+barat!3m4!1s0x2e6a03362e1eb293:0x236590930283dbc!8m2!3d-6.1200612!4d106.7199331"
PT Japfa Comfeed Indonesia Tbk,"Graha Praba Samantha, Jalan Daan Mogot Raya KM 12 No. 9, Cengkareng Timur, RT.12/RW.13, Cengkareng Tim., Kecamatan Cengkareng, Kota Jakarta Barat, Daerah Khusus Ibukota Jakarta 11730","Graha Praba Samantha, Jalan Daan Mogot Raya KM 12 No. 9, Cengkareng Timur, RT.12/RW.13, Cengkareng Tim., Kecamatan Cengkareng",Kota Jakarta Barat,Daerah Khusus Ibukota Jakarta,11730,RPWW+84,japfacomfeed.co.id,(021) 25617010,"-6.154134, 106.7453582",Kantor Perusahaan,"Rabu 08.00–17.00,Kamis 08.00–17.00,Jumat 08.00–17.00,Sabtu Tutup,Minggu Tutup,Senin 08.00–17.00,Selasa 08.00–17.00. Sembunyikan jam buka untuk seminggu",N,"4,7",132,,11,https://lh5.googleusercontent.com/p/AF1QipOCbd6Cv-aiBqJ52LwriDdTGRxNqnVnLz7s2lUw=w470-h240-k-no,"https://www.google.com/maps/place/PT+Japfa+Comfeed+Indonesia+Tbk/@-6.2086897,106.5741444,10z/data=!4m8!1m2!2m1!1sperusahaan+di+dekat+Ciputra+International+Puri+jakarta+barat!3m4!1s0x2e69f7ea1378ccb9:0x37aec7dca3421704!8m2!3d-6.154134!4d106.7453582"
pt indofood sukses makmur,"Jl. Daan Mogot No.92, Poris Gaga, Kec. Batuceper, Kota Tangerang, Banten 15122","Jl. Daan Mogot No.92, Poris Gaga, Kec. Batuceper",Kota Tangerang,Banten,15122,RMQM+R6,indofood.com,,"-6.1603792, 106.6830283",Kantor Perusahaan,"Rabu 07.00–21.00,Kamis 07.00–21.00,Jumat 07.00–21.00,Sabtu 07.00–21.00,Minggu Tutup,Senin 07.00–21.00,Selasa 07.00–21.00. Sembunyikan jam buka untuk seminggu",N,"4,6",35,,11,https://lh5.googleusercontent.com/p/AF1QipNTOayHVIFVgkOpPt9E2uci-Yh3BKZqxr40wOzG=w408-h816-k-no,"https://www.google.com/maps/place/pt+indofood+sukses+makmur/@-6.2086897,106.5741444,10z/data=!4m8!1m2!2m1!1sperusahaan+di+dekat+Ciputra+International+Puri+jakarta+barat!3m4!1s0x2e69f86759b50037:0x3cb775105f3661a4!8m2!3d-6.1603792!4d106.6830283"
Ruko Golf Lake,"RT.9/RW.14, Cengkareng Tim., Kecamatan Cengkareng, Kota Jakarta Barat, Daerah Khusus Ibukota Jakarta 11730","RT.9/RW.14, Cengkareng Tim., Kecamatan Cengkareng",Kota Jakarta Barat,Daerah Khusus Ibukota Jakarta,11730,VP9J+F6,,,"-6.131341, 106.730511",Kantor Perusahaan,,N,"4,0",5,,7,https://lh5.googleusercontent.com/p/AF1QipMa9HUOSBDyBMqWV7DrAaxdGK9VNg0EiXytSpzW=w408-h306-k-no,"https://www.google.com/maps/place/Ruko+Golf+Lake/@-6.2086897,106.5741444,10z/data=!4m8!1m2!2m1!1sperusahaan+di+dekat+Ciputra+International+Puri+jakarta+barat!3m4!1s0x2e6a1d5173e62ce9:0xf1fe521216e9ceb7!8m2!3d-6.131341!4d106.730511"
PT. Angkasa Pura Logistik Kantor Cabang Jakarta,"Ruko Taman Mahkota Blok A 2 No.27, Benda, Kota Tangerang, Banten 15125","Ruko Taman Mahkota Blok A 2 No.27, Benda",Kota Tangerang,Banten,15125,VMJQ+JF,aplog.co,(021) 54360922,"-6.1184153, 106.688736",Kantor Perusahaan,"Rabu 08.00–17.00,Kamis 08.00–17.00,Jumat 08.00–16.00,Sabtu Tutup,Minggu Tutup,Senin 08.00–17.00,Selasa 08.00–17.00. Sembunyikan jam buka untuk seminggu",Y,"5,0",4,,15,https://lh5.googleusercontent.com/p/AF1QipMts6YCP3jrXIX-p4mrXzefmbvMZpfzVprm2_g1=w408-h724-k-no,"https://www.google.com/maps/place/PT.+Angkasa+Pura+Logistik+Kantor+Cabang+Jakarta/@-6.2086897,106.5741444,10z/data=!4m8!1m2!2m1!1sperusahaan+di+dekat+Ciputra+International+Puri+jakarta+barat!3m4!1s0x2e6a02ed5cdfb985:0xf35fc0340feba241!8m2!3d-6.1184153!4d106.688736"
Ultrajaya Milk Industry Tbk. PT,"JL. Daan Mogot Raya Km. 18, Kalideres Cengkareng, Kompleks Pergudangan Nila Alam Gudang A, 11850, RT.2/RW.3, Kalideres, Kec. Kalideres, Kota Jakarta Barat, Daerah Khusus Ibukota Jakarta 11850","JL. Daan Mogot Raya Km. 18, Kalideres Cengkareng, Kompleks Pergudangan Nila Alam Gudang A, 11850, RT.2/RW.3, Kalideres, Kec. Kalideres",Kota Jakarta Barat,Daerah Khusus Ibukota Jakarta,11850,RPV2+4W,ultrajaya.co.id,(021) 54373334,"-6.1571813, 106.7022578",Toko Olahan Susu,,N,"2,6",7,,0,https://geo2.ggpht.com/maps/photothumb/fd/v1?bpb=ChAKDnNlYXJjaC5UQUNUSUxFEiwKEglf1_n8FPhpLhEKdVD_8Y7JGxIKDWeHVPwVUHWZPyoKDRt9VPwV8niZPxoGCPABEJgD&gl=ID,"https://www.google.com/maps/place/Ultrajaya+Milk+Industry+Tbk.+PT/@-6.2086897,106.5741444,10z/data=!4m8!1m2!2m1!1sperusahaan+di+dekat+Ciputra+International+Puri+jakarta+barat!3m4!1s0x2e69f814fcf9d75f:0x1bc98ef1ff50750a!8m2!3d-6.1571813!4d106.7022578"
OT Building (Headquarter),"Jl. Lkr. Luar Barat No.Kav. 35-36, RT.1/RW.3, Rw. Buaya, Kecamatan Cengkareng, Kota Jakarta Barat, Daerah Khusus Ibukota Jakarta 11740","Jl. Lkr. Luar Barat No.Kav. 35-36, RT.1/RW.3, Rw. Buaya, Kecamatan Cengkareng",Kota Jakarta Barat,Daerah Khusus Ibukota Jakarta,11740,RPMH+H5,ot.id,(021) 58397777,"-6.1660915, 106.7279051",Kantor Perusahaan,"Rabu 07.30–17.00,Kamis 07.30–17.00,Jumat 07.30–17.00,Sabtu Tutup,Minggu Tutup,Senin 07.30–17.00,Selasa 07.30–17.00. Sembunyikan jam buka untuk seminggu",N,"4,5",470,,344,https://lh5.googleusercontent.com/p/AF1QipO7LKfh7__XJthQXYesFwi6FYd-aU1URIDMolRd=w425-h240-k-no,"https://www.google.com/maps/place/OT+Building+(Headquarter)/@-6.2086897,106.5741444,10z/data=!4m8!1m2!2m1!1sperusahaan+di+dekat+Ciputra+International+Puri+jakarta+barat!3m4!1s0x2e69f789220fe9db:0xf1e69f9ce4c45609!8m2!3d-6.1660915!4d106.7279051"
ANTERAJA HUB/SS RAWA BUAYA,"Jl. Router Ring Road Lkr. Luar No.39, RT.13/RW.1, Rw. Buaya, Kecamatan Cengkareng, Kota Jakarta Barat, Daerah Khusus Ibukota Jakarta 11740","Jl. Router Ring Road Lkr. Luar No.39, RT.13/RW.1, Rw. Buaya, Kecamatan Cengkareng",Kota Jakarta Barat,Daerah Khusus Ibukota Jakarta,11740,RPRH+GC,anteraja.id,,"-6.1586508, 106.7285705",Kantor Perusahaan,"Rabu 07.00–19.00,Kamis 07.00–19.00,Jumat 07.00–19.00,Sabtu 07.00–19.00,Minggu 07.00–19.00,Senin 07.00–19.00,Selasa 07.00–19.00. Sembunyikan jam buka untuk seminggu",N,"1,9",16,,4,https://lh5.googleusercontent.com/p/AF1QipMF3nEq75M502kurAA-9e68RLCzpjirWl0Hu-xN=w408-h306-k-no,"https://www.google.com/maps/place/ANTERAJA+HUB%2FSS+RAWA+BUAYA/@-6.2086897,106.5741444,10z/data=!4m8!1m2!2m1!1sperusahaan+di+dekat+Ciputra+International+Puri+jakarta+barat!3m4!1s0x2e69f7f6e9e33ba5:0x1340f8b2418ce25c!8m2!3d-6.1586508!4d106.7285705"
Panca Budi Pratama,"Kawasan Pusat Niaga Terpadu, Jl. Daan Mogot Raya Km. 19,6 Blok D No. 8 A-D, Batuceper, Kebon Besar, Poris Jaya, Kec. Batuceper, Kota Tangerang, Banten 15122","Kawasan Pusat Niaga Terpadu, Jl. Daan Mogot Raya Km. 19,6 Blok D No. 8 A-D, Batuceper, Kebon Besar, Poris Jaya, Kec. Batuceper",Kota Tangerang,Banten,15122,RMPH+7H,pancabudi.com,(021) 54365555,"-6.164364, 106.6789067",Kantor Perusahaan,"Rabu 08.00–17.00,Kamis 08.00–17.00,Jumat 08.00–17.00,Sabtu 08.00–17.00,Minggu 08.00–17.00,Senin 08.00–17.00,Selasa 08.00–17.00. Sembunyikan jam buka untuk seminggu",Y,"4,2",219,,40,https://lh5.googleusercontent.com/p/AF1QipPUJF6w5NY4uZfZme88ZWqD9u65KB1JuorO0QeV=w408-h544-k-no,"https://www.google.com/maps/place/Panca+Budi+Pratama/@-6.2086897,106.5741444,10z/data=!4m8!1m2!2m1!1sperusahaan+di+dekat+Ciputra+International+Puri+jakarta+barat!3m4!1s0x2e69f81437a6ad57:0x6c0d72175e255018!8m2!3d-6.164364!4d106.6789067"
PT. Angkasa Pura II,"Soekarno-Hatta International Airport Building, 600, Pajang, Benda, Kota Tangerang, Banten 15126","Soekarno-Hatta International Airport Building, 600, Pajang, Benda",Kota Tangerang,Banten,15126,VMF4+XF,angkasapura2.co.id,(021) 1500138,"-6.1250571, 106.6561829",Kantor Perusahaan,"Rabu 07.30–16.30,Kamis 07.30–16.30,Jumat 07.30–16.30,Sabtu Tutup,Minggu Tutup,Senin 07.30–16.30,Selasa 07.30–16.30. Sembunyikan jam buka untuk seminggu",Y,"4,5",251,,132,https://lh5.googleusercontent.com/p/AF1QipOMhDSKSVCKUM_T57Qfcg1BDeEbh7Bcq5XryBqQ=w408-h392-k-no,"https://www.google.com/maps/place/PT.+Angkasa+Pura+II/@-6.2086897,106.5741444,10z/data=!4m8!1m2!2m1!1sperusahaan+di+dekat+Ciputra+International+Puri+jakarta+barat!3m4!1s0x2e6a026bf3ac54bb:0x9e34ee9e3e412372!8m2!3d-6.1250571!4d106.6561829"
Orang Tua Group,"Jl. Lkr. Luar Barat No.Kav 35-36, RT.1/RW.3, Rw. Buaya, Kecamatan Cengkareng, Kota Jakarta Barat, Daerah Khusus Ibukota Jakarta 11740","Jl. Lkr. Luar Barat No.Kav 35-36, RT.1/RW.3, Rw. Buaya, Kecamatan Cengkareng",Kota Jakarta Barat,Daerah Khusus Ibukota Jakarta,11740,RPMH+G5,ot.id,(021) 58397888,"-6.1661544, 106.7278899",Kantor Perusahaan,"Rabu 07.30–17.00,Kamis 07.30–17.00,Jumat 07.30–17.00,Sabtu Tutup,Minggu Tutup,Senin 07.30–17.00,Selasa 07.30–17.00. Sembunyikan jam buka untuk seminggu",N,"4,4",238,,75,https://lh5.googleusercontent.com/p/AF1QipNpo188K0XdAAXr2R7mBwHA1tOBFyHPP1MZh1Oj=w426-h240-k-no,"https://www.google.com/maps/place/Orang+Tua+Group/@-6.2086897,106.5741444,10z/data=!4m8!1m2!2m1!1sperusahaan+di+dekat+Ciputra+International+Puri+jakarta+barat!3m4!1s0x2e69f7ebea8d61d1:0x2b7fe4e094742af8!8m2!3d-6.1661544!4d106.7278899"
HALOSIS,"Tokopedia Care, Jl. Lkr. Luar Barat No.101, Rawa Buaya, Cengkareng, West Jakarta City, Jakarta 11740               Terletak di: Tokopedia Care Tower","Tokopedia Care, Jl. Lkr. Luar Barat No.101, Rawa Buaya, Cengkareng",West Jakarta City,Jakarta,11740               Terletak di: Tokopedia Care Tower,RPGJ+M3,halosis.co.id,(021) 22585511,"-6.1733288, 106.730139",Kantor Perusahaan,"Rabu 08.00–17.00,Kamis 08.00–17.00,Jumat 08.00–17.00,Sabtu Tutup,Minggu Tutup,Senin 08.00–17.00,Selasa 08.00–17.00. Sembunyikan jam buka untuk seminggu",Y,"5,0",27,,7,https://lh5.googleusercontent.com/p/AF1QipMIXNp1xW4qXjs78sK2A_gje6i-Mf7r34TtsuAc=w408-h306-k-no,"https://www.google.com/maps/place/HALOSIS/@-6.2086897,106.5741444,10z/data=!4m8!1m2!2m1!1sperusahaan+di+dekat+Ciputra+International+Puri+jakarta+barat!3m4!1s0x2e69f7cde4504b65:0xdc2386d5f81ac49!8m2!3d-6.1733288!4d106.730139"
VIP ROOM BANDARA SOEKARNO HATTA,"Pajang, Benda, Kota Tangerang, Banten 15126","Pajang, Benda",Kota Tangerang,Banten,15126,VM95+R3,angkasapura2.co.id,,"-6.1303921, 106.6576254",Kantor Perusahaan,"Rabu Buka 24 jam,Kamis Buka 24 jam,Jumat Buka 24 jam,Sabtu Buka 24 jam,Minggu Buka 24 jam,Senin Buka 24 jam,Selasa Buka 24 jam. Sembunyikan jam buka untuk seminggu",N,"4,6",11,,8,https://lh5.googleusercontent.com/p/AF1QipP2XDvS-kF9wvPjEOQkIT7x0AoGl6PI3fDDFYLZ=w426-h240-k-no,"https://www.google.com/maps/place/VIP+ROOM+BANDARA+SOEKARNO+HATTA/@-6.2086897,106.5741444,10z/data=!4m8!1m2!2m1!1sperusahaan+di+dekat+Ciputra+International+Puri+jakarta+barat!3m4!1s0x2e6a026df133aa37:0x69221fa329265455!8m2!3d-6.1303921!4d106.6576254"
Swiss-Belhotel International,"The Blugreen Boutique Office, 2nd floor, Jl. Lingkar Luar Barat Kav. 88, Puri Kembangan, Jakarta, RT.6/RW.1, North Kembangan, Kembangan, West Jakarta City, Jakarta 11610","The Blugreen Boutique Office, 2nd floor, Jl. Lingkar Luar Barat Kav. 88, Puri Kembangan, Jakarta, RT.6/RW.1, North Kembangan, Kembangan",West Jakarta City,Jakarta,11610,RPFH+7H,swiss-belhotel.com,(021) 29527277,"-6.17679, 106.728937",Kantor Perusahaan,,Y,"4,2",48,,8,https://lh5.googleusercontent.com/p/AF1QipMjVLAllhJliwdlqIYAfXGwdAadXRjLh6vVsOcu=w408-h725-k-no,"https://www.google.com/maps/place/Swiss-Belhotel+International/@-6.2086897,106.5741444,10z/data=!4m8!1m2!2m1!1sperusahaan+di+dekat+Ciputra+International+Puri+jakarta+barat!3m4!1s0x2e69f78179278455:0xd52105c5b21b197d!8m2!3d-6.17679!4d106.728937"
AMC Terminal 2,"Bandar Udara Internasional Soekarno–Hatta, Terminal 1C Boarding Lounge, Jl. Operasional Cengkareng, Pajang, Benda, Kota Tangerang, Banten 15126","Bandar Udara Internasional Soekarno–Hatta, Terminal 1C Boarding Lounge, Jl. Operasional Cengkareng, Pajang, Benda",Kota Tangerang,Banten,15126,VMH3+J5,angkasapura2.co.id,(021) 5505956,"-6.1208918, 106.6529392",Kantor Perusahaan,"Rabu Buka 24 jam,Kamis Buka 24 jam,Jumat Buka 24 jam,Sabtu Buka 24 jam,Minggu Buka 24 jam,Senin Buka 24 jam,Selasa Buka 24 jam. Sembunyikan jam buka untuk seminggu",N,"5,0",2,,0,https://maps.gstatic.com/tactile/pane/default_geocode-1x.png,"https://www.google.com/maps/place/AMC+Terminal+2/@-6.2086897,106.5741444,10z/data=!4m8!1m2!2m1!1sperusahaan+di+dekat+Ciputra+International+Puri+jakarta+barat!3m4!1s0x2e6a023fe4ec6843:0xa4a51360aabef8f3!8m2!3d-6.1208918!4d106.6529392"
PT. Massindo International,"Jl. Meruya Ilir Raya Taman Kb. Jeruk Blk. AIII No.1, RT.4/RW.7, Meruya Sel., Kec. Kembangan, Kota Jakarta Barat, Daerah Khusus Ibukota Jakarta 11610","Jl. Meruya Ilir Raya Taman Kb. Jeruk Blk. AIII No.1, RT.4/RW.7, Meruya Sel., Kec. Kembangan",Kota Jakarta Barat,Daerah Khusus Ibukota Jakarta,11610,,massindo.com,(021) 29223333,"-6.198412, 106.745598",Kantor Perusahaan,"Rabu 08.30–17.00,Kamis 08.30–17.00,Jumat 08.30–17.00,Sabtu 08.30–17.00,Minggu Tutup,Senin 08.30–17.00,Selasa 08.30–17.00. Sembunyikan jam buka untuk seminggu",Y,"4,1",20,,4,https://lh5.googleusercontent.com/p/AF1QipOrRfAChIEj-u7gqsJ5PCpc17lvOhTAKJKq4tTZ=w564-h240-k-no,"https://www.google.com/maps/place/PT.+Massindo+International/@-6.2087449,106.7142637,11z/data=!4m8!1m2!2m1!1sperusahaan+di+dekat+Ciputra+International+Puri+jakarta+barat!3m4!1s0x2e69f76abe037151:0x2cc328b35d062820!8m2!3d-6.198412!4d106.745598"
Pt.Mayora Indah Tbk. Divisi,"Jl. Yos Sudarso No.107, Kb. Besar, Kec. Batuceper, Kota Tangerang, Banten 15122","Jl. Yos Sudarso No.107, Kb. Besar, Kec. Batuceper",Kota Tangerang,Banten,15122,RMVJ+PX,mayoraindah.co.id,(021) 36218001,"-6.1556839, 106.682468",Pabrik Coklat,"Rabu Buka 24 jam,Kamis Buka 24 jam,Jumat Buka 24 jam,Sabtu Buka 24 jam,Minggu Buka 24 jam,Senin Buka 24 jam,Selasa Buka 24 jam. Sembunyikan jam buka untuk seminggu",Y,"4,5",185,,123,https://lh5.googleusercontent.com/p/AF1QipNMvfa3pYbw0y8UxEHkvxeVEj1Ui1ri8dfs7XEK=w408-h544-k-no,"https://www.google.com/maps/place/Pt.Mayora+Indah+Tbk.+Divisi/@-6.1556839,106.5423923,11z/data=!4m8!1m2!2m1!1sperusahaan+di+dekat+Ciputra+International+Puri+jakarta+barat!3m4!1s0x2e69f864080e5b55:0x78ea1047b813ade7!8m2!3d-6.1556839!4d106.682468"
Delta Beton,"Sebelah Ciputra International, Jl. Lkr. Luar Barat No.3, RT.14, Rw. Buaya, Kecamatan Cengkareng, Kota Jakarta Barat, Daerah Khusus Ibukota Jakarta 11740","Sebelah Ciputra International, Jl. Lkr. Luar Barat No.3, RT.14, Rw. Buaya, Kecamatan Cengkareng",Kota Jakarta Barat,Daerah Khusus Ibukota Jakarta,11740,RPGH+VC,deltabeton.org,0812-1984-4450,"-6.1727853, 106.7285316",Pemasok Semen Ready-mix,"Rabu 08.00–17.00,Kamis 08.00–17.00,Jumat 08.00–17.00,Sabtu 08.00–15.00,Minggu Tutup,Senin 08.00–17.00,Selasa 08.00–17.00. Sembunyikan jam buka untuk seminggu",Y,"5,0",3,,21,https://lh5.googleusercontent.com/p/AF1QipP3Bn9vXcZmZSerx5Yg39PXm7yMGmqP1gP8s6Pm=w426-h240-k-no,"https://www.google.com/maps/place/Delta+Beton/@-6.2087449,106.7142637,11z/data=!4m8!1m2!2m1!1sperusahaan+di+dekat+Ciputra+International+Puri+jakarta+barat!3m4!1s0x2e69f78690c9d567:0x3744f413fc3ea1db!8m2!3d-6.1727853!4d106.7285316"
BPJS Ketenagakerjaan,"Ruko Mutiara Taman Palem Cengkareng Timur, Blok A5 No.17, Jl. Lingkar Luar Barat Cengkareng, Cengkareng, RT.7/RW.14, Cengkareng Tim., Kecamatan Cengkareng, Kota Jakarta Barat, Daerah Khusus Ibukota Jakarta 11730               Terletak di: Ruko Mutiara Taman Palem","Ruko Mutiara Taman Palem Cengkareng Timur, Blok A5 No.17, Jl. Lingkar Luar Barat Cengkareng, Cengkareng, RT.7/RW.14, Cengkareng Tim., Kecamatan Cengkareng",Kota Jakarta Barat,Daerah Khusus Ibukota Jakarta,11730               Terletak di: Ruko Mutiara Taman Palem,VP6J+X7,bpjsketenagakerjaan.go.id,(021) 29018921,"-6.1375362, 106.7307133",Perusahaan Asuransi,"Rabu 08.00–17.00,Kamis 08.00–17.00,Jumat 08.00–17.00,Sabtu Tutup,Minggu Tutup,Senin 08.00–17.00,Selasa 08.00–17.00. Sembunyikan jam buka untuk seminggu",N,"2,4",37,,6,https://lh5.googleusercontent.com/p/AF1QipMCKFmMtRtH68lycjylfuWUqVFZfK8vGJV-q3eD=w408-h838-k-no,"https://www.google.com/maps/place/BPJS+Ketenagakerjaan/@-6.2087449,106.7142637,11z/data=!4m8!1m2!2m1!1sperusahaan+di+dekat+Ciputra+International+Puri+jakarta+barat!3m4!1s0x2e6a1d561522a3af:0xbd6e1b13447f0ee5!8m2!3d-6.1375362!4d106.7307133"
Apartemen Ciputra International,"RW.4, Rawa Buaya, Cengkareng, West Jakarta City, Jakarta 11740","RW.4, Rawa Buaya, Cengkareng",West Jakarta City,Jakarta,11740,RPGJ+W8,,,"-6.1726838, 106.7308151",Biro Jasa Penyewaan Kondominium,,N,"5,0",1,,0,https://maps.gstatic.com/tactile/pane/default_geocode-1x.png,"https://www.google.com/maps/place/Apartemen+Ciputra+International/@-6.2087449,106.7142637,11z/data=!4m8!1m2!2m1!1sperusahaan+di+dekat+Ciputra+International+Puri+jakarta+barat!3m4!1s0x2e69f7285853298d:0x45930b1572f6f491!8m2!3d-6.1726838!4d106.7308151"
Wisma Akr,"Jl. Panjang No.5, RT.11/RW.10, Kb. Jeruk, Kec. Kb. Jeruk, Kota Jakarta Barat, Daerah Khusus Ibukota Jakarta 11530","Jl. Panjang No.5, RT.11/RW.10, Kb. Jeruk, Kec. Kb. Jeruk",Kota Jakarta Barat,Daerah Khusus Ibukota Jakarta,11530,RQ59+88,akr.co.id,,"-6.1916293, 106.7682663",Kantor Perusahaan,,Y,"4,5",135,,34,https://lh5.googleusercontent.com/p/AF1QipNDt6z0NoBhqbYGSIRW2BdV3TM0tzAyQPlq4j4G=w408-h306-k-no,"https://www.google.com/maps/place/Wisma+Akr/@-6.2087449,106.7142637,11z/data=!4m8!1m2!2m1!1sperusahaan+di+dekat+Ciputra+International+Puri+jakarta+barat!3m4!1s0x2e69f71dae3dae3b:0x90163e99a268110e!8m2!3d-6.1916293!4d106.7682663"
Astra World,"Jl. Taman Ratu Indah, RT.11/RW.1, Duri Kepa, Kec. Kb. Jeruk, Kota Jakarta Barat, Daerah Khusus Ibukota Jakarta 11520","Jl. Taman Ratu Indah, RT.11/RW.1, Duri Kepa, Kec. Kb. Jeruk",Kota Jakarta Barat,Daerah Khusus Ibukota Jakarta,11520,RQC8+9W,astra.co.id,0813-8738-1505,"-6.1790689, 106.7672577",,"Rabu Tutup,Kamis Tutup,Jumat Tutup,Sabtu 08.00–07.00,Minggu Tutup,Senin 08.00–07.00,Selasa Tutup. Sembunyikan jam buka untuk seminggu",N,,,,0,https://maps.gstatic.com/tactile/pane/default_geocode-1x.png,"https://www.google.com/maps/place/Astra+World/@-6.2087449,106.7142637,11z/data=!4m8!1m2!2m1!1sperusahaan+di+dekat+Ciputra+International+Puri+jakarta+barat!3m4!1s0x2e69f7008f20aa17:0xae84fd81075165f2!8m2!3d-6.1790689!4d106.7672577"
PT. Panca Budi,"Blok, Daan Mogot Rd No.Blok B, Poris Jaya, Batuceper, Tangerang City, Banten 15122","Blok, Daan Mogot Rd No.Blok B, Poris Jaya, Batuceper",Tangerang City,Banten,15122,RMPH+7H,pancabudi.com,(021) 29029086,"-6.1643619, 106.6789327",Kantor Perusahaan,"Rabu 08.00–17.00,Kamis 08.00–17.00,Jumat 08.00–17.00,Sabtu Tutup,Minggu Tutup,Senin 08.00–17.00,Selasa 08.00–17.00. Sembunyikan jam buka untuk seminggu",Y,"4,1",10,,7,https://lh5.googleusercontent.com/p/AF1QipPecFI5W75lOECIiHRSVm2W8_G4pL9eGqopynOe=w408-h725-k-no,"https://www.google.com/maps/place/PT.+Panca+Budi/@-6.1643619,106.538857,11z/data=!4m8!1m2!2m1!1sperusahaan+di+dekat+Ciputra+International+Puri+jakarta+barat!3m4!1s0x2e69f85f1f26e455:0x68b85a7589b3d25a!8m2!3d-6.1643619!4d106.6789327"
Global Indonesia,"BLK. 1A, No. 4, Ruko Komplek Daan Mogot, Kintamani Barat, Kalideres, 11840 Jakarta Barat, Indonesia, RT.8/RW.12, Kalideres, West Jakarta City, Jakarta 11840","BLK. 1A, No. 4, Ruko Komplek Daan Mogot, Kintamani Barat, Kalideres, 11840 Jakarta Barat, Indonesia, RT.8/RW.12, Kalideres",West Jakarta City,Jakarta,11840,RPX6+W7,globalteleshop.com,(021) 5457990,"-6.1502, 106.71063",Perusahaan Jasa Hak Properti,,N,"5,0",1,,0,https://geo3.ggpht.com/cbk?panoid=hSpnVDGdcvkbGtzpPIGXhQ&output=thumbnail&cb_client=search.TACTILE.gps&thumb=2&w=408&h=240&yaw=248.62292&pitch=0&thumbfov=100,"https://www.google.com/maps/place/Global+Indonesia/@-6.2087449,106.7142637,11z/data=!4m8!1m2!2m1!1sperusahaan+di+dekat+Ciputra+International+Puri+jakarta+barat!3m4!1s0x2e69f81010c46371:0xbd61fff9cde6e21c!8m2!3d-6.1502!4d106.71063"
Gedung 600,"Jl. C3, Pajang, Benda, Kota Tangerang, Banten 15126","Jl. C3, Pajang, Benda",Kota Tangerang,Banten,15126,VMF4+WF,angkasapura2.co.id,1 500 138,"-6.125159, 106.6561405",Kantor Perusahaan,"Rabu 07.30–16.30,Kamis 07.30–16.30,Jumat 07.30–16.30,Sabtu Tutup,Minggu Tutup,Senin 07.30–16.30,Selasa 07.30–16.30. Sembunyikan jam buka untuk seminggu",N,"4,6",71,,18,https://lh5.googleusercontent.com/p/AF1QipPPdwGzhSQTZaw755xa_zToQCp9oGCORSugdD1a=w408-h306-k-no,"https://www.google.com/maps/place/Gedung+600/@-6.125159,106.5160648,11z/data=!4m8!1m2!2m1!1sperusahaan+di+dekat+Ciputra+International+Puri+jakarta+barat!3m4!1s0x2e6a026b84f3d8d9:0x8b5cbd6126b490a7!8m2!3d-6.125159!4d106.6561405"
