BusinessName,FullAddress,StreetAddress,City,State,Zip,PlusCode,Website,Phone,LatLong,Category,Hours,IsClaimed,Rating,ReviewCount,Amenities,NumberOfPhotos,ImageURL,URL
Jasamarga Kunciran Cengkareng,"Jl. Jenderal Sudirman No.1, Babakan, Kec. Tangerang, Kota Tangerang, Banten 15118","Jl. Jenderal Sudirman No.1, Babakan, Kec. Tangerang",Kota Tangerang,Banten,15118,RJ4P+G6,jasamarga.com,(021) 55782453,"-6.1936285, 106.635587",Kantor Perusahaan,"Rabu 08.00–18.00,Kamis 08.00–18.00,Jumat 08.00–18.00,Sabtu Tutup,Minggu Tutup,Senin 08.00–18.00,Selasa 08.00–18.00. Sembunyikan jam buka untuk seminggu",N,"4,4",7,,3,https://lh5.googleusercontent.com/p/AF1QipOiSrGBJF1Vk5iLY85TJ0yNvIvP53wgWcJF1_zO=w426-h240-k-no,"https://www.google.com/maps/place/Jasamarga+Kunciran+Cengkareng/@-6.1936285,106.6005681,13z/data=!4m8!1m2!2m1!1sperusahaan+di+dekat+Ciputra+International+Puri+jakarta+barat!3m4!1s0x2e69f931f19da9ab:0xcbc9081d286ad980!8m2!3d-6.1936285!4d106.635587"
pt. hm sampoerna tbk,"Jl. Penjernihan 1 No.36-50, RW.8, Bend. Hilir, Kecamatan Tanah Abang, Kota Jakarta Pusat, Daerah Khusus Ibukota Jakarta 10210","Jl. Penjernihan 1 No.36-50, RW.8, Bend. Hilir, Kecamatan Tanah Abang",Kota Jakarta Pusat,Daerah Khusus Ibukota Jakarta,10210,QRX5+C6,,,"-6.2014568, 106.8080383",Kantor Perusahaan,,N,"4,0",9,,3,https://lh5.googleusercontent.com/p/AF1QipOC8qRLedueozeMAunlanthOVbVL1ZDHDXDJZon=w426-h240-k-no,"https://www.google.com/maps/place/pt.+hm+sampoerna+tbk/@-6.2014568,106.7730194,13z/data=!4m8!1m2!2m1!1sperusahaan+di+dekat+Ciputra+International+Puri+jakarta+barat!3m4!1s0x2e69f6a36c366a23:0x77dfa18e2009a648!8m2!3d-6.2014568!4d106.8080383"
PT Astra International Tbk,"Sunter II Jl. Gaya Motor Raya No.8, RW.8, Sungai Bambu, Tj. Priok, Kota Jkt Utara, Daerah Khusus Ibukota Jakarta 14330","Sunter II Jl. Gaya Motor Raya No.8, RW.8, Sungai Bambu, Tj. Priok",Kota Jkt Utara,Daerah Khusus Ibukota Jakarta,14330,VV7P+JQ,astra.co.id,(021) 6522555,"-6.1359273, 106.8869137",Kantor Perusahaan,"Rabu 07.30–16.30,Kamis 07.30–16.30,Jumat 07.30–16.30,Sabtu 07.30–16.30,Minggu Tutup,Senin 07.30–16.30,Selasa 07.30–16.30. Sembunyikan jam buka untuk seminggu",N,"4,6",1656,,2237,https://lh5.googleusercontent.com/p/AF1QipNVmxJwonIrpvCoa4qsMcD-ck6mzDQTX0ZnSFE=w408-h544-k-no,"https://www.google.com/maps/place/PT+Astra+International+Tbk/@-6.1359273,106.8518948,13z/data=!4m8!1m2!2m1!1sperusahaan+di+dekat+Ciputra+International+Puri+jakarta+barat!3m4!1s0x2e69f56067291d09:0x607f1ce3721ce098!8m2!3d-6.1359273!4d106.8869137"
PT Wahana Ottomitra Multiartha,"Ruko Mega Glodok Kemayoran Blok C No. 27-28, Jl. Angkasa, RW.10, Gn. Sahari Sel., Kec. Kemayoran, Kota Jakarta Pusat, Daerah Khusus Ibukota Jakarta 10610","Ruko Mega Glodok Kemayoran Blok C No. 27-28, Jl. Angkasa, RW.10, Gn. Sahari Sel., Kec. Kemayoran",Kota Jakarta Pusat,Daerah Khusus Ibukota Jakarta,10610,RRWX+2J,wom.co.id,(021) 29371345,"-6.1549361, 106.8490456",Kantor Perusahaan,"Rabu 08.30–16.00,Kamis 08.30–16.00,Jumat 08.30–16.00,Sabtu 08.30–00.00,Minggu Tutup,Senin 08.30–16.00,Selasa 08.30–16.00. Sembunyikan jam buka untuk seminggu",Y,"4,0",152,,22,https://lh5.googleusercontent.com/p/AF1QipNCDaxNEzzJTf3UdXyrafNP_3T5AIzwP_Iwm0M=w408-h261-k-no,"https://www.google.com/maps/place/PT+Wahana+Ottomitra+Multiartha/@-6.2087622,106.819334,13z/data=!4m8!1m2!2m1!1sperusahaan+di+dekat+Ciputra+International+Puri+jakarta+barat!3m4!1s0x2e69f5961e5bd7d1:0x92e66f64b4e5ec5e!8m2!3d-6.1549361!4d106.8490456"
Kantor Jasa Raharja Pusat,"Jl. HR Rasuna Said No.Kav C2, RT.10/RW.2, Karet, Kecamatan Setiabudi, Kota Jakarta Selatan, Daerah Khusus Ibukota Jakarta 12920","Jl. HR Rasuna Said No.Kav C2, RT.10/RW.2, Karet, Kecamatan Setiabudi",Kota Jakarta Selatan,Daerah Khusus Ibukota Jakarta,12920,QRPJ+WC,jasaraharja.co.id,(021) 5203454,"-6.21271, 106.831051",Kantor Perusahaan,"Rabu 08.00–17.00,Kamis 08.00–17.00,Jumat 08.00–17.00,Sabtu Tutup,Minggu Tutup,Senin 08.00–17.00,Selasa 08.00–17.00. Sembunyikan jam buka untuk seminggu",N,"4,5",106,,70,https://lh5.googleusercontent.com/p/AF1QipN4Gm1gG4Z-5-A3R5s_X2kT7gwyJy0GvLhe3nx6=w426-h240-k-no,"https://www.google.com/maps/place/Kantor+Jasa+Raharja+Pusat/@-6.2087622,106.819334,13z/data=!4m8!1m2!2m1!1sperusahaan+di+dekat+Ciputra+International+Puri+jakarta+barat!3m4!1s0x2e69f408b86f6dab:0xbe2352affec6a0d!8m2!3d-6.21271!4d106.831051"
Central Plan Production (CPP) PT Griya Miesejati,"Jl. Darma Wanita 1 No.9, RT.13/RW.1, Duri Kosambi, Kecamatan Cengkareng, Kota Jakarta Barat, Daerah Khusus Ibukota Jakarta 11750","Jl. Darma Wanita 1 No.9, RT.13/RW.1, Duri Kosambi, Kecamatan Cengkareng",Kota Jakarta Barat,Daerah Khusus Ibukota Jakarta,11750,RPVH+8C,bakmigm.com,(021) 5655008,"-6.1567315, 106.7285031",Pabrik Tepung,"Rabu 06.00–19.00,Kamis 06.00–19.00,Jumat 06.00–19.00,Sabtu 06.00–19.00,Minggu 06.00–19.00,Senin 06.00–19.00,Selasa 06.00–19.00. Sembunyikan jam buka untuk seminggu",N,"4,8",24,,2,https://lh5.googleusercontent.com/p/AF1QipOXeEuDUaKFNVuUF21jXRH8UY_y1z6GMWr_5H5Y=w408-h725-k-no,"https://www.google.com/maps/place/Central+Plan+Production+(CPP)+PT+Griya+Miesejati/@-6.1567315,106.6934842,13z/data=!4m8!1m2!2m1!1sperusahaan+di+dekat+Ciputra+International+Puri+jakarta+barat!3m4!1s0x2e69f7f488f197fb:0x99910c72f4f04eac!8m2!3d-6.1567315!4d106.7285031"
PT. Enseval Putera Megatrading Tbk,"JL. Srengseng Raya, No.8, No.8 Rt.08 Rw.02, Kel.Srengseng Kec. Kembangan, RT.2/RW.8, Srengseng, Kec. Kembangan, Kota Jakarta Barat, Daerah Khusus Ibukota Jakarta 11630","JL. Srengseng Raya, No.8, No.8 Rt.08 Rw.02, Kel.Srengseng Kec. Kembangan, RT.2/RW.8, Srengseng, Kec. Kembangan",Kota Jakarta Barat,Daerah Khusus Ibukota Jakarta,11630,RQ34+3C,enseval.com,(021) 5863556,"-6.1973418, 106.7560904",Perusahaan Farmasi,"Rabu 08.00–16.00,Kamis 08.00–16.00,Jumat 08.00–16.00,Sabtu 08.00–13.00,Minggu Tutup,Senin 08.00–16.00,Selasa 08.00–16.00. Sembunyikan jam buka untuk seminggu",N,"3,8",10,,3,https://lh5.googleusercontent.com/p/AF1QipPz94w8nC1PkeuvutoS0Lujq2Hsc-HfpiW4T1FH=w408-h306-k-no,"https://www.google.com/maps/place/PT.+Enseval+Putera+Megatrading+Tbk/@-6.1973418,106.7210715,13z/data=!4m8!1m2!2m1!1sperusahaan+di+dekat+Ciputra+International+Puri+jakarta+barat!3m4!1s0x2e69f72de926f9e7:0x6efd1ef4270804f2!8m2!3d-6.1973418!4d106.7560904"
PT. JAPFA Comfeed Indonesia Tbk.,"Wisma Millenia, Jl. Letjen Mt. Haryono No.Kav 16, RT.11/RW.5, Tebet Bar., Kec. Tebet, Kota Jakarta Selatan, Daerah Khusus Ibukota Jakarta 12810","Wisma Millenia, Jl. Letjen Mt. Haryono No.Kav 16, RT.11/RW.5, Tebet Bar., Kec. Tebet",Kota Jakarta Selatan,Daerah Khusus Ibukota Jakarta,12810,QV42+XJ,japfacomfeed.co.id,(021) 28545680,"-6.2425481, 106.8515522",Kantor Perusahaan,"Rabu 08.00–17.00,Kamis 08.00–17.00,Jumat 08.00–17.00,Sabtu Tutup,Minggu Tutup,Senin 08.00–17.00,Selasa 08.00–17.00. Sembunyikan jam buka untuk seminggu",N,"4,5",150,,52,https://lh5.googleusercontent.com/p/AF1QipMaH2mf2WaHkWJOnUfJa71eEcxT9C6c_QJQZEVQ=w408-h544-k-no,"https://www.google.com/maps/place/PT.+JAPFA+Comfeed+Indonesia+Tbk./@-6.2425481,106.8165333,13z/data=!4m8!1m2!2m1!1sperusahaan+di+dekat+Ciputra+International+Puri+jakarta+barat!3m4!1s0x2e69f3bb6ee0f71d:0x60c6a4f8e64214f5!8m2!3d-6.2425481!4d106.8515522"
PT. Mayora Indah,"Jalan Pangeran Jayakarta, RT.7/RW.7, Mangga Dua Selatan, Sawah Besar, RT.7/RW.7, Mangga Dua Sel., Kecamatan Sawah Besar, Kota Jakarta Pusat, Daerah Khusus Ibukota Jakarta 10730","Jalan Pangeran Jayakarta, RT.7/RW.7, Mangga Dua Selatan, Sawah Besar, RT.7/RW.7, Mangga Dua Sel., Kecamatan Sawah Besar",Kota Jakarta Pusat,Daerah Khusus Ibukota Jakarta,10730,VR4H+RP,mayoraindah.co.id,(021) 50127999,"-6.1429215, 106.8293709",Kantor Perusahaan,,N,"5,0",6,,0,https://geo3.ggpht.com/cbk?panoid=idkbrvz7rSXmDZ3AHYKCRA&output=thumbnail&cb_client=search.TACTILE.gps&thumb=2&w=408&h=240&yaw=230.4219&pitch=0&thumbfov=100,"https://www.google.com/maps/place/PT.+Mayora+Indah/@-6.1429215,106.794352,13z/data=!4m8!1m2!2m1!1sperusahaan+di+dekat+Ciputra+International+Puri+jakarta+barat!3m4!1s0x2e69f5fa7ef4f951:0x28c6dd7e36895f7c!8m2!3d-6.1429215!4d106.8293709"
MULTIKON,"Jl. Panjang No.55, RT.5/RW.10, Kb. Jeruk, Kec. Kb. Jeruk, Kota Jakarta Barat, Daerah Khusus Ibukota Jakarta 11530","Jl. Panjang No.55, RT.5/RW.10, Kb. Jeruk, Kec. Kb. Jeruk",Kota Jakarta Barat,Daerah Khusus Ibukota Jakarta,11530,RQ39+M9,multikon.co.id,(021) 53650036,"-6.1958354, 106.768413",Perusahaan Konstruksi,,Y,"4,4",57,,36,https://lh5.googleusercontent.com/p/AF1QipNrgHuu09MFem3aJuAj2g3QsFJ3ciDCDKoetWVp=w408-h306-k-no,"https://www.google.com/maps/place/MULTIKON/@-6.1958354,106.7333941,13z/data=!4m8!1m2!2m1!1sperusahaan+di+dekat+Ciputra+International+Puri+jakarta+barat!3m4!1s0x2e69f71e4c155bcf:0xdaeb58833b4cbd!8m2!3d-6.1958354!4d106.768413"
Data Room - Digi Planet Indosat Ooredoo Head Office,"RT.2/RW.3, Gambir, Kecamatan Gambir, Kota Jakarta Pusat, Daerah Khusus Ibukota Jakarta 10110","RT.2/RW.3, Gambir, Kecamatan Gambir",Kota Jakarta Pusat,Daerah Khusus Ibukota Jakarta,10110,RR9C+XP,indosatooredoo.com,,"-6.1801226, 106.8218162",Kantor Perusahaan,,N,"5,0",2,,0,https://geo3.ggpht.com/cbk?panoid=DcGBB6-u1w9bIk-h3f1_WA&output=thumbnail&cb_client=search.TACTILE.gps&thumb=2&w=408&h=240&yaw=188.43726&pitch=0&thumbfov=100,"https://www.google.com/maps/place/Data+Room+-+Digi+Planet+Indosat+Ooredoo+Head+Office/@-6.2087622,106.819334,13z/data=!4m8!1m2!2m1!1sperusahaan+di+dekat+Ciputra+International+Puri+jakarta+barat!3m4!1s0x2e69f42bba6c8447:0x5e4da5e2ee5c7927!8m2!3d-6.1801226!4d106.8218162"
PT Daiti Carbon Nusantara,"Graha Indramas, Jl. Ks. Tubun No.77, RT.14/RW.5, Slipi, Kec. Palmerah, Kota Jakarta Barat, Daerah Khusus Ibukota Jakarta 11410","Graha Indramas, Jl. Ks. Tubun No.77, RT.14/RW.5, Slipi, Kec. Palmerah",Kota Jakarta Barat,Daerah Khusus Ibukota Jakarta,11410,RQ2X+2W,lautan-luas.com,(021) 53696209,"-6.1999322, 106.7998351",,"Rabu 08.00–16.00,Kamis 08.00–16.00,Jumat 08.00–16.00,Sabtu Tutup,Minggu Tutup,Senin 08.00–16.00,Selasa 08.00–16.00. Sembunyikan jam buka untuk seminggu",N,,,,0,https://geo1.ggpht.com/cbk?panoid=PXoT2YLxZWDCvcvz4vFE0A&output=thumbnail&cb_client=search.TACTILE.gps&thumb=2&w=408&h=240&yaw=273.0717&pitch=0&thumbfov=100,"https://www.google.com/maps/place/PT+Daiti+Carbon+Nusantara/@-6.1999322,106.7648162,13z/data=!4m8!1m2!2m1!1sperusahaan+di+dekat+Ciputra+International+Puri+jakarta+barat!3m4!1s0x2e69f6be7ebbcbd7:0x4321d894b780ca82!8m2!3d-6.1999322!4d106.7998351"
Travelio.com,"Graha APIC, Jl. Ir. H. Juanda No.15, RT.14/RW.4, Kebon Kelapa, Gambir, Central Jakarta City, Jakarta 10120","Graha APIC, Jl. Ir. H. Juanda No.15, RT.14/RW.4, Kebon Kelapa, Gambir",Central Jakarta City,Jakarta,10120,RRMH+42,travelio.com,(021) 3857081,"-6.1671803, 106.8275584",Kantor Perusahaan,,N,"3,9",106,,11,https://lh5.googleusercontent.com/p/AF1QipMWvYyOys8zNnltBO1aIWNbi3E0zVrvPwHSbYOt=w408-h408-k-no,"https://www.google.com/maps/place/Travelio.com/@-6.2087622,106.819334,13z/data=!4m8!1m2!2m1!1sperusahaan+di+dekat+Ciputra+International+Puri+jakarta+barat!3m4!1s0x2e69f52ae0a94e23:0xc79978c17ee008b8!8m2!3d-6.1671803!4d106.8275584"
Unilever Indonesia PT Tbk,"Jl. Johar No.18, RT.18/RW.6, Kb. Sirih, Kec. Menteng, Kota Jakarta Pusat, Daerah Khusus Ibukota Jakarta 10340","Jl. Johar No.18, RT.18/RW.6, Kb. Sirih, Kec. Menteng",Kota Jakarta Pusat,Daerah Khusus Ibukota Jakarta,10340,RR7J+5G,unilever.com,(021) 31936326,"-6.1871173, 106.8312976",Kantor Perusahaan,"Rabu 08.00–21.30,Kamis 08.00–21.30,Jumat 08.00–21.30,Sabtu Tutup,Minggu Tutup,Senin 08.00–21.30,Selasa 08.00–21.30. Sembunyikan jam buka untuk seminggu",N,"3,8",5,,0,https://geo0.ggpht.com/cbk?panoid=IIGseWE9IXQrG-4Rk306UQ&output=thumbnail&cb_client=search.TACTILE.gps&thumb=2&w=408&h=240&yaw=2.2761638&pitch=0&thumbfov=100,"https://www.google.com/maps/place/Unilever+Indonesia+PT+Tbk/@-6.2087622,106.819334,13z/data=!4m8!1m2!2m1!1sperusahaan+di+dekat+Ciputra+International+Puri+jakarta+barat!3m4!1s0x2e69f43a97758ba1:0x278036cb46a8e83d!8m2!3d-6.1871173!4d106.8312976"
Bentoel Distribusi Utama Hidayat,"Jl. Pluit Karang Karya Tim. No.8A, RT.23/RW.8, Penjaringan, Jakarta Utara, Kota Jkt Utara, Daerah Khusus Ibukota Jakarta 14440","Jl. Pluit Karang Karya Tim. No.8A, RT.23/RW.8, Penjaringan, Jakarta Utara",Kota Jkt Utara,Daerah Khusus Ibukota Jakarta,14440,VQFQ+65,bentoelgroup.com,,"-6.1269404, 106.787963",Gudang,,N,"5,0",3,,0,https://geo2.ggpht.com/cbk?panoid=MMHK43gmaRZX2XykmCGoFg&output=thumbnail&cb_client=search.TACTILE.gps&thumb=2&w=408&h=240&yaw=280.1169&pitch=0&thumbfov=100,"https://www.google.com/maps/place/Bentoel+Distribusi+Utama+Hidayat/@-6.1269404,106.7529441,13z/data=!4m8!1m2!2m1!1sperusahaan+di+dekat+Ciputra+International+Puri+jakarta+barat!3m4!1s0x2e6a1d8e00855939:0x7abd0488c38e3d6d!8m2!3d-6.1269404!4d106.787963"
PT HM Sampoerna,"Jalan Angkasa No.19, RT.7/RW.5, Gunung Sahari Utara, Kemayoran, RT.7/RW.5, Gn. Sahari Utara, Kecamatan Sawah Besar, Kota Jakarta Pusat, Daerah Khusus Ibukota Jakarta 10610","Jalan Angkasa No.19, RT.7/RW.5, Gunung Sahari Utara, Kemayoran, RT.7/RW.5, Gn. Sahari Utara, Kecamatan Sawah Besar",Kota Jakarta Pusat,Daerah Khusus Ibukota Jakarta,10610,RRRQ+PH,sampoerna.com,(021) 56835286,"-6.1582188, 106.8389176",Kantor Perusahaan,"Rabu 08.00–17.00,Kamis 08.00–17.00,Jumat 08.00–17.00,Sabtu 08.00–14.00,Minggu Tutup,Senin 08.00–17.00,Selasa 08.00–17.00. Sembunyikan jam buka untuk seminggu",N,"4,3",21,,4,https://lh5.googleusercontent.com/p/AF1QipMCymN6d8UwViQkUePLNSzHbhuBGfB4rd6GOT5D=w408-h306-k-no,"https://www.google.com/maps/place/PT+HM+Sampoerna/@-6.2087622,106.819334,13z/data=!4m8!1m2!2m1!1sperusahaan+di+dekat+Ciputra+International+Puri+jakarta+barat!3m4!1s0x2e69f5c0fc07a50f:0xb9a33295ae18e5ca!8m2!3d-6.1582188!4d106.8389176"
PT Paragon Technology and Innovation,"Jl. Ciledug Raya No.10, RT.18/RW.3, Ulujami, Kec. Pesanggrahan, Kota Jakarta Selatan, Daerah Khusus Ibukota Jakarta 12250","Jl. Ciledug Raya No.10, RT.18/RW.3, Ulujami, Kec. Pesanggrahan",Kota Jakarta Selatan,Daerah Khusus Ibukota Jakarta,12250,QQ76+2Q,paragon-innovation.com,(021) 5853883,"-6.237491, 106.7619875",Kantor Perusahaan,"Rabu 09.00–17.00,Kamis 09.00–17.00,Jumat 09.00–17.00,Sabtu Tutup,Minggu Tutup,Senin 09.00–17.00,Selasa 09.00–17.00. Sembunyikan jam buka untuk seminggu",N,"4,3",24,,0,https://geo3.ggpht.com/cbk?panoid=SU3CrKy0tDY5rmUwOqpymQ&output=thumbnail&cb_client=search.TACTILE.gps&thumb=2&w=408&h=240&yaw=2.2368217&pitch=0&thumbfov=100,"https://www.google.com/maps/place/PT+Paragon+Technology+and+Innovation/@-6.237491,106.7269686,13z/data=!4m8!1m2!2m1!1sperusahaan+di+dekat+Ciputra+International+Puri+jakarta+barat!3m4!1s0x2e69f0dda9055403:0xfa13930b4534815e!8m2!3d-6.237491!4d106.7619875"
Anteraja larangan( staging store),"Ruko Puri Beta 1, Larangan Utara, Kec. Larangan, Kota Tangerang, Banten 15154","Ruko Puri Beta 1, Larangan Utara, Kec. Larangan",Kota Tangerang,Banten,15154,QP9G+HJ,anteraja.id,(021) 50603333,"-6.2310165, 106.7265404",Kantor Perusahaan,"Rabu 08.00–20.00,Kamis 08.00–20.00,Jumat 08.00–20.00,Sabtu 08.00–20.00,Minggu 08.00–20.00,Senin 08.00–20.00,Selasa 08.00–20.00. Sembunyikan jam buka untuk seminggu",Y,"5,0",2,,11,https://lh5.googleusercontent.com/p/AF1QipPynVki5jNyPFzHMzQ5lEMSrxTvMOhb3zOZedef=w426-h240-k-no,"https://www.google.com/maps/place/Anteraja+larangan(+staging+store)/@-6.2310165,106.6915215,13z/data=!4m8!1m2!2m1!1sperusahaan+di+dekat+Ciputra+International+Puri+jakarta+barat!3m4!1s0x2e69f1a9ee486279:0xa8394390bb2755ab!8m2!3d-6.2310165!4d106.7265404"
Property Inside Group,"Komplek Moneter, Jl. Sasak 2, D10. Kel, RT.4/RW.2, Klp. Dua, Kec. Kb. Jeruk, Kota Jakarta Barat, Daerah Khusus Ibukota Jakarta 11550","Komplek Moneter, Jl. Sasak 2, D10. Kel, RT.4/RW.2, Klp. Dua, Kec. Kb. Jeruk",Kota Jakarta Barat,Daerah Khusus Ibukota Jakarta,11550,QQVC+R9,propertyinside.id,(021) 22534437,"-6.2054461, 106.7709741",Perusahaan Manajemen Properti,"Rabu Buka 24 jam,Kamis Buka 24 jam,Jumat Buka 24 jam,Sabtu Buka 24 jam,Minggu Buka 24 jam,Senin Buka 24 jam,Selasa Buka 24 jam. Sembunyikan jam buka untuk seminggu",Y,"5,0",3,,7,https://lh5.googleusercontent.com/p/AF1QipOH2ALUgbnE7LiK2auiA8AJ25xIAcmMz_OSoQr-=w408-h306-k-no,"https://www.google.com/maps/place/Property+Inside+Group/@-6.2087622,106.819334,13z/data=!4m8!1m2!2m1!1sperusahaan+di+dekat+Ciputra+International+Puri+jakarta+barat!3m4!1s0x2e69f773dbc23379:0xf40a81034fca2351!8m2!3d-6.2054461!4d106.7709741"
PT. Gudang Garam Tbk.,"Jl. Jend. Ahmad Yani No.79, RT.5/RW.7, Cemp. Putih Tim., Kec. Cemp. Putih, Kota Jakarta Pusat, Daerah Khusus Ibukota Jakarta 10510","Jl. Jend. Ahmad Yani No.79, RT.5/RW.7, Cemp. Putih Tim., Kec. Cemp. Putih",Kota Jakarta Pusat,Daerah Khusus Ibukota Jakarta,10510,RVHG+6C,gudanggaramtbk.com,(021) 29557000,"-6.1719721, 106.8760171",Kantor Perusahaan,"Rabu 08.00–17.00,Kamis 08.00–17.00,Jumat 08.00–17.00,Sabtu Tutup,Minggu Tutup,Senin 08.00–17.00,Selasa 08.00–17.00. Sembunyikan jam buka untuk seminggu",N,"4,4",710,,561,https://lh5.googleusercontent.com/p/AF1QipO_SJnWD3Ti86KwA1jE-xB7NlLALIHFNRXg_s2k=w648-h240-k-no,"https://www.google.com/maps/place/PT.+Gudang+Garam+Tbk./@-6.2087622,106.819334,13z/data=!4m8!1m2!2m1!1sperusahaan+di+dekat+Ciputra+International+Puri+jakarta+barat!3m4!1s0x2e69f4fcd8decf31:0x3da8e32854a410b3!8m2!3d-6.1719721!4d106.8760171"
"PT. Enseval Putera Megatrading, Tbk. Cab. Tangerang","Jl. Pajajaran, Gandasari, Kec. Jatiuwung, Kota Tangerang, Banten 15137","Jl. Pajajaran, Gandasari, Kec. Jatiuwung",Kota Tangerang,Banten,15137,QHWP+X8,enseval.com,(021) 29172101,"-6.2025097, 106.5858106",Kantor Perusahaan,"Selasa 08.00–04.00,Rabu 08.00–04.00,Kamis 08.00–04.00,Jumat 08.00–04.00,Sabtu 08.00–04.00,Minggu Tutup,Senin 08.00–04.00. Sembunyikan jam buka untuk seminggu",N,"4,8",26,,15,https://lh5.googleusercontent.com/p/AF1QipPMXZn7H-3rrzAfcthQPIxOMaxjHvWiNR1xdF1h=w408-h725-k-no,"https://www.google.com/maps/place/PT.+Enseval+Putera+Megatrading,+Tbk.+Cab.+Tangerang/@-6.2025097,106.5507917,13z/data=!4m8!1m2!2m1!1sperusahaan+di+dekat+Ciputra+International+Puri+jakarta+barat!3m4!1s0x2e69fef4f04fac2f:0x226e27f0f66a2438!8m2!3d-6.2025097!4d106.5858106"
Marketing Gallery Citra Living Citra 7 Ext,"CitraGarden City, Jl. Citra 7, RW.11, Kalideres, Kec. Kalideres, Kota Jakarta Barat, Daerah Khusus Ibukota Jakarta 11840","CitraGarden City, Jl. Citra 7, RW.11, Kalideres, Kec. Kalideres",Kota Jakarta Barat,Daerah Khusus Ibukota Jakarta,11840,VP32+CM,citralivingjakarta.com,(021) 54399885,"-6.1464928, 106.7017035",Perusahaan Manajemen Properti,"Rabu 09.00–19.00,Kamis 09.00–19.00,Jumat 09.00–19.00,Sabtu 09.00–19.00,Minggu 09.00–19.00,Senin 09.00–19.00,Selasa 09.00–19.00. Sembunyikan jam buka untuk seminggu",Y,"4,3",21,,85,https://lh5.googleusercontent.com/p/AF1QipNzOYjftC4bHcurV0sNe6HBVJa-6d6iTol2Duh4=w408-h306-k-no,"https://www.google.com/maps/place/Marketing+Gallery+Citra+Living+Citra+7+Ext/@-6.1464928,106.6666846,13z/data=!4m8!1m2!2m1!1sperusahaan+di+dekat+Ciputra+International+Puri+jakarta+barat!3m4!1s0x2e69f80ce8c54e7b:0xccc2f699b04fa7d0!8m2!3d-6.1464928!4d106.7017035"
PT Total Bangun Persada Tbk,"Jl. Letjen S. Parman No.Kav. 106, RT.12/RW.3, Tomang, Kec. Grogol petamburan, Kota Jakarta Barat, Daerah Khusus Ibukota Jakarta 11440","Jl. Letjen S. Parman No.Kav. 106, RT.12/RW.3, Tomang, Kec. Grogol petamburan",Kota Jakarta Barat,Daerah Khusus Ibukota Jakarta,11440,RQFV+8Q,totalbp.com,(021) 5666999,"-6.1766661, 106.7944802",Perusahaan Konstruksi,"Rabu 08.30–17.30,Kamis 08.30–17.30,Jumat 08.30–17.30,Sabtu Tutup,Minggu Tutup,Senin 08.30–17.30,Selasa 08.30–17.30. Sembunyikan jam buka untuk seminggu",Y,"4,5",299,,234,https://lh5.googleusercontent.com/p/AF1QipPa3orAjiR-bfWuKi0p7zVFAmw4wa_mKnCxSypi=w408-h306-k-no,"https://www.google.com/maps/place/PT+Total+Bangun+Persada+Tbk/@-6.2087622,106.819334,13z/data=!4m8!1m2!2m1!1sperusahaan+di+dekat+Ciputra+International+Puri+jakarta+barat!3m4!1s0x2e69f660050af591:0xa0ca846938def3cb!8m2!3d-6.1766661!4d106.7944802"
Grha Unilever,"Green Office Park Kav. 3 Jl. BSD Boulevard Barat BSD City, Sampora, Kec. Cisauk, Tangerang, Banten 15345","Green Office Park Kav. 3 Jl. BSD Boulevard Barat BSD City, Sampora, Kec. Cisauk",Tangerang,Banten,15345,MJXX+FJ,unilever.co.id,(021) 80827000,"-6.3013355, 106.6491134",Kantor Perusahaan,"Rabu 07.30–17.00,Kamis 07.30–17.00,Jumat 07.30–17.00,Sabtu Tutup,Minggu Tutup,Senin 07.30–17.00,Selasa 07.30–17.00. Sembunyikan jam buka untuk seminggu",N,"4,7",868,,1051,https://lh5.googleusercontent.com/p/AF1QipM_ENWtU2ZpPf0Gb3D6BTNd5QIxR4oJrHaDnDEW=w408-h306-k-no,"https://www.google.com/maps/place/Grha+Unilever/@-6.3013355,106.6140945,13z/data=!4m8!1m2!2m1!1sperusahaan+di+dekat+Ciputra+International+Puri+jakarta+barat!3m4!1s0x2e69fb4a34a66e5d:0x90972b7464869d41!8m2!3d-6.3013355!4d106.6491134"
Astra Agro Lounge,"Jl. Jend. Sudirman No.Kav 5-6, RT.10/RW.11, Karet Tengsin, Tanahabang, Kota Jakarta Pusat, Daerah Khusus Ibukota Jakarta 10220","Jl. Jend. Sudirman No.Kav 5-6, RT.10/RW.11, Karet Tengsin, Tanahabang",Kota Jakarta Pusat,Daerah Khusus Ibukota Jakarta,10220,QRVC+3H,astra-agro.co.id,,"-6.2073227, 106.8214769",,"Rabu 08.00–18.00,Kamis 08.00–18.00,Jumat 08.00–18.00,Sabtu Tutup,Minggu Tutup,Senin 08.00–18.00,Selasa 08.00–18.00. Sembunyikan jam buka untuk seminggu",N,,,,5,https://lh5.googleusercontent.com/p/AF1QipOH-4KDp9iCSZ1Xif63GbXe89TL2e93S-8r0VJr=w408-h271-k-no,"https://www.google.com/maps/place/Astra+Agro+Lounge/@-6.2073227,106.786458,13z/data=!4m8!1m2!2m1!1sperusahaan+di+dekat+Ciputra+International+Puri+jakarta+barat!3m4!1s0x2e69f54df2f02ca3:0xa7299b28756f3cdc!8m2!3d-6.2073227!4d106.8214769"
Tanamera Coffee Ciputra International,"Tokopedia Care Tower Ground Floor Ciputra International, Jl. Lkr. Luar Barat No.101, RT.14, Kembangan Utara, Kecamatan Cengkareng, Kota Jakarta Barat, Daerah Khusus Ibukota Jakarta 11740","Tokopedia Care Tower Ground Floor Ciputra International, Jl. Lkr. Luar Barat No.101, RT.14, Kembangan Utara, Kecamatan Cengkareng",Kota Jakarta Barat,Daerah Khusus Ibukota Jakarta,11740,RPGJ+M2,tanameracoffee.com,(021) 22955697,"-6.1733613, 106.7300315",$$Kedai Kopi,"Rabu 07.00–19.00,Kamis 07.00–19.00,Jumat 07.00–19.00,Sabtu 07.00–13.00,Minggu Tutup,Senin 07.00–19.00,Selasa 07.00–19.00. Sembunyikan jam buka untuk seminggu",N,"5,0",2,,4,https://lh5.googleusercontent.com/p/AF1QipNPEP-AayTocJoTu5bAGSg7gKS72vWkAqK5Wl8R=w408-h544-k-no,"https://www.google.com/maps/place/Tanamera+Coffee+Ciputra+International/@-6.1733613,106.6950126,13z/data=!4m8!1m2!2m1!1sperusahaan+di+dekat+Ciputra+International+Puri+jakarta+barat!3m4!1s0x2e69f7f00c8858e9:0xc7bf5b5d2893ef67!8m2!3d-6.1733613!4d106.7300315"
Apartment CitraLake Suites,"5, Bulevar Citra 6 RT.4/RW.5 CitraGarden City Kalideres, RT.4/RW.4, Tegal Alur, Kec. Kalideres, Kota Jakarta Barat, Daerah Khusus Ibukota Jakarta 11820","5, Bulevar Citra 6 RT.4/RW.5 CitraGarden City Kalideres, RT.4/RW.4, Tegal Alur, Kec. Kalideres",Kota Jakarta Barat,Daerah Khusus Ibukota Jakarta,11820,VPF7+43,citralakesuites.com,(021) 29020300,"-6.1271792, 106.7126965",Gedung Apartemen,,Y,"4,0",15,,86,https://lh5.googleusercontent.com/p/AF1QipMPpIR2Tk4BChnNpcN2WvbgUoqQ6niFj48F7fiW=w493-h240-k-no,"https://www.google.com/maps/place/Apartment+CitraLake+Suites/@-6.1271792,106.6776776,13z/data=!4m8!1m2!2m1!1sperusahaan+di+dekat+Ciputra+International+Puri+jakarta+barat!3m4!1s0x2e6a02b03c9a2ee5:0x7ea1d36ca4266bbf!8m2!3d-6.1271792!4d106.7126965"
Gedung Tempo Pavilion 1,"Tempo Pavilion 1, Jl. H. R. Rasuna Said No.11, RT.7/RW.2, Kuningan, Kuningan Tim., Setia Budi, Kota Jakarta Selatan, Daerah Khusus Ibukota Jakarta 12950","Tempo Pavilion 1, Jl. H. R. Rasuna Said No.11, RT.7/RW.2, Kuningan, Kuningan Tim., Setia Budi",Kota Jakarta Selatan,Daerah Khusus Ibukota Jakarta,12950,QRCM+R2,,,"-6.2278869, 106.8325413",Kantor Perusahaan,,N,"4,5",52,,25,https://lh5.googleusercontent.com/p/AF1QipNQspyLeLES6hNES6JV1qq9O6IYdh5O8zEq2t0-=w408-h306-k-no,"https://www.google.com/maps/place/Gedung+Tempo+Pavilion+1/@-6.2278869,106.7975224,13z/data=!4m8!1m2!2m1!1sperusahaan+di+dekat+Ciputra+International+Puri+jakarta+barat!3m4!1s0x2e69f3efcd576011:0x2ad3fc278cb0815e!8m2!3d-6.2278869!4d106.8325413"
PT. Enseval Putera Megatrading,"Jl. Pajajaran No.200-225, Gandasari, Kec. Jatiuwung, Kota Tangerang, Banten 15137","Jl. Pajajaran No.200-225, Gandasari, Kec. Jatiuwung",Kota Tangerang,Banten,15137,QHXP+27,,,"-6.2024314, 106.5856386",Kantor Perusahaan,,N,"4,4",30,,10,https://lh5.googleusercontent.com/p/AF1QipPMVKW_pg-6fClbJdsm2YTiVlSg8mPvw4N75D3s=w408-h306-k-no,"https://www.google.com/maps/place/PT.+Enseval+Putera+Megatrading/@-6.2024314,106.5506197,13z/data=!4m8!1m2!2m1!1sperusahaan+di+dekat+Ciputra+International+Puri+jakarta+barat!3m4!1s0x2e69fef4f6bbfd9b:0x2c413d19add0c46e!8m2!3d-6.2024314!4d106.5856386"
FIFGROUP JAKARTA 1 (Pramuka),"Jalan Pramuka Raya No.15, RT.12/RW.5, Rawasari, Cempaka Putih, RT.12/RW.5, Rawasari, Kec. Cemp. Putih, Kota Jakarta Pusat, Daerah Khusus Ibukota Jakarta 10570","Jalan Pramuka Raya No.15, RT.12/RW.5, Rawasari, Cempaka Putih, RT.12/RW.5, Rawasari, Kec. Cemp. Putih",Kota Jakarta Pusat,Daerah Khusus Ibukota Jakarta,10570,RV58+49,fifgroup.co.id,(021) 21475044,"-6.1922012, 106.8659958",Kantor Perusahaan,"Rabu 08.00–16.00,Kamis 08.00–16.00,Jumat 08.00–16.00,Sabtu 08.00–13.00,Minggu Tutup,Senin 08.00–16.00,Selasa 08.00–16.00. Sembunyikan jam buka untuk seminggu",N,"4,1",60,,19,https://lh5.googleusercontent.com/p/AF1QipMY-BWaS3c2hnUvgiO3TTm18H3uXPIR-jocTFYc=w408-h306-k-no,"https://www.google.com/maps/place/FIFGROUP+JAKARTA+1+(Pramuka)/@-6.2087622,106.819334,13z/data=!4m8!1m2!2m1!1sperusahaan+di+dekat+Ciputra+International+Puri+jakarta+barat!3m4!1s0x2e69f4f590f109c5:0xe1a5c593158432e1!8m2!3d-6.1922012!4d106.8659958"
