BusinessName,FullAddress,StreetAddress,City,State,Zip,PlusCode,Website,Phone,LatLong,Category,Hours,IsClaimed,Rating,ReviewCount,Amenities,NumberOfPhotos,ImageURL,URL
PT. Gudang Garam TBK,"Jalan Tahi Bonar Simatupang No. 89, RT. 3 / RW. 2, Tanjung Barat, Jagakarsa, RT.3/RW.2, Tj. Bar., Kec. Jagakarsa, Kota Jakarta Selatan, Daerah Khusus Ibukota Jakarta 12530","Jalan Tahi Bonar Simatupang No. 89, RT. 3 / RW. 2, Tanjung Barat, Jagakarsa, RT.3/RW.2, Tj. Bar., Kec. Jagakarsa",Kota Jakarta Selatan,Daerah Khusus Ibukota Jakarta,12530,MRWW+4M,gudanggaramtbk.com,(021) 7823613,"-6.3047037, 106.8467392",Kantor Perusahaan,"Rabu 08.00–16.00,Kamis 08.00–16.00,Jumat 08.00–16.00,Sabtu Tutup,Minggu Tutup,Senin 08.00–16.00,Selasa 08.00–16.00. Sembunyikan jam buka untuk seminggu",N,"4,1",56,,14,https://lh5.googleusercontent.com/p/AF1QipO6jN_gGCR7a7NAUNpX1ob0qnDbqjRJJEVhx-Im=w426-h240-k-no,"https://www.google.com/maps/place/PT.+Gudang+Garam+TBK/@-6.3047037,106.8117203,13z/data=!4m8!1m2!2m1!1sperusahaan+di+dekat+Ciputra+International+Puri+jakarta+barat!3m4!1s0x2e69ed8c19c7ef71:0x4f54c670c987a869!8m2!3d-6.3047037!4d106.8467392"
PT. Unilever Indonesia,"Gama Tower 27th Floor, Jl. H. R. Rasuna Said, RT.2/RW.5, Karet Kuningan, Kecamatan Setiabudi, Kota Jakarta Selatan, Daerah Khusus Ibukota Jakarta 12940","Gama Tower 27th Floor, Jl. H. R. Rasuna Said, RT.2/RW.5, Karet Kuningan, Kecamatan Setiabudi",Kota Jakarta Selatan,Daerah Khusus Ibukota Jakarta,12940,QRGM+CF,unilever.co.id,0813-3379-9900,"-6.2239467, 106.8336943",,"Rabu 15.00–00.00,Kamis 15.00–00.00,Jumat 15.00–00.00,Sabtu 15.00–00.00,Minggu 10.00–00.00,Senin 15.00–00.00,Selasa 15.00–00.00. Sembunyikan jam buka untuk seminggu",N,,,,0,https://lh5.googleusercontent.com/p/AF1QipPySPqzcO6h5SYs8zNcZLITIkgGIpq03vdBzlW3=w436-h240-k-no,"https://www.google.com/maps/place/PT.+Unilever+Indonesia/@-6.2087622,106.819334,13z/data=!4m8!1m2!2m1!1sperusahaan+di+dekat+Ciputra+International+Puri+jakarta+barat!3m4!1s0x2e69f392f721b003:0x45b87107f6628988!8m2!3d-6.2239467!4d106.8336943"
PT WOM Finance Tbk (Head Office),"Altira Business Park, Jl. Yos Sudarso Kav 85, RT.9/RW.11, Sunter Jaya, Tj. Priok, Kota Jkt Utara, Daerah Khusus Ibukota Jakarta 14360","Altira Business Park, Jl. Yos Sudarso Kav 85, RT.9/RW.11, Sunter Jaya, Tj. Priok",Kota Jkt Utara,Daerah Khusus Ibukota Jakarta,14360,RVXP+2P,wom.co.id,(021) 21882400,"-6.1523942, 106.886773",Kantor Perusahaan,"Rabu 08.30–17.00,Kamis 08.30–17.00,Jumat 08.30–17.00,Sabtu Tutup,Minggu Tutup,Senin 08.30–17.00,Selasa 08.30–17.00. Sembunyikan jam buka untuk seminggu",N,"3,0",8,,12,https://lh5.googleusercontent.com/p/AF1QipND9lC2pyMQ90sl6FOWPztV-oTCg2y0WxxBTUEp=w426-h240-k-no,"https://www.google.com/maps/place/PT+WOM+Finance+Tbk+(Head+Office)/@-6.1523942,106.8517541,13z/data=!4m8!1m2!2m1!1sperusahaan+di+dekat+Ciputra+International+Puri+jakarta+barat!3m4!1s0x2e69f5668a882555:0xb6de290f75cfd400!8m2!3d-6.1523942!4d106.886773"
Ciputra International Puri 1 Phase 3,"Jl. Lkr. Luar Barat No.3, RT.5/RW.1, Duri Kosambi, Kb. Jeruk, Kota Jakarta Barat, Daerah Khusus Ibukota Jakarta 11730","Jl. Lkr. Luar Barat No.3, RT.5/RW.1, Duri Kosambi, Kb. Jeruk",Kota Jakarta Barat,Daerah Khusus Ibukota Jakarta,11730,RPQG+8V,,,"-6.161638, 106.727169",,,N,,,,0,https://geo3.ggpht.com/cbk?panoid=2NexOVxNT-8kqMxaOK9fcw&output=thumbnail&cb_client=search.TACTILE.gps&thumb=2&w=408&h=240&yaw=81.90463&pitch=0&thumbfov=100,"https://www.google.com/maps/place/Ciputra+International+Puri+1+Phase+3/@-6.161638,106.6921501,13z/data=!4m8!1m2!2m1!1sperusahaan+di+dekat+Ciputra+International+Puri+jakarta+barat!3m4!1s0x2e69f78b08092779:0xc809ab84529f6cc!8m2!3d-6.161638!4d106.727169"
Ingredients Master by Lautan Luas,"Graha Indramas, 8th Floor Jalan AIP II, Jl. Ks. Tubun No.77, RT.14/RW.5, Slipi, Kec. Palmerah, Kota Jakarta Barat, Daerah Khusus Ibukota Jakarta 11410","Graha Indramas, 8th Floor Jalan AIP II, Jl. Ks. Tubun No.77, RT.14/RW.5, Slipi, Kec. Palmerah",Kota Jakarta Barat,Daerah Khusus Ibukota Jakarta,11410,RQ2X+2W,lautan-luas.com,(021) 80660777,"-6.1998966, 106.7998373",Pemasok Produk Makanan,"Rabu 08.00–17.00,Kamis 08.00–17.00,Jumat 08.00–17.00,Sabtu Tutup,Minggu Tutup,Senin 08.00–17.00,Selasa 08.00–17.00. Sembunyikan jam buka untuk seminggu",N,"5,0",9,,2,https://geo3.ggpht.com/cbk?panoid=znpkLoawhQfpEkTpo18Yvw&output=thumbnail&cb_client=search.TACTILE.gps&thumb=2&w=408&h=240&yaw=264.26892&pitch=0&thumbfov=100,"https://www.google.com/maps/place/Ingredients+Master+by+Lautan+Luas/@-6.2087622,106.819334,13z/data=!4m8!1m2!2m1!1sperusahaan+di+dekat+Ciputra+International+Puri+jakarta+barat!3m4!1s0x2e69f70b55079075:0xae39ee654f9ee47!8m2!3d-6.1998966!4d106.7998373"
PT. Unilever Indonesia Tbk,"Menara Duta, Lantai 5, Jl. H. R. Rasuna Said, RT.3/RW.1, Kuningan, Setia Budi, Kuningan, Kota Jakarta Selatan, Daerah Khusus Ibukota Jakarta 12910","Menara Duta, Lantai 5, Jl. H. R. Rasuna Said, RT.3/RW.1, Kuningan, Setia Budi, Kuningan",Kota Jakarta Selatan,Daerah Khusus Ibukota Jakarta,12910,QRRH+FR,unilever.co.id,(021) 80827000,"-6.2087835, 106.8295501",Kantor Perusahaan,,N,"4,0",25,,0,https://geo2.ggpht.com/cbk?panoid=UnDMBRHhgcnzZjj9Hn4GNA&output=thumbnail&cb_client=search.TACTILE.gps&thumb=2&w=408&h=240&yaw=260.67578&pitch=0&thumbfov=100,"https://www.google.com/maps/place/PT.+Unilever+Indonesia+Tbk/@-6.2087622,106.819334,13z/data=!4m8!1m2!2m1!1sperusahaan+di+dekat+Ciputra+International+Puri+jakarta+barat!3m4!1s0x2e69f40562d8106d:0x56541339cd1f1405!8m2!3d-6.2087835!4d106.8295501"